Track Name,Artist,Artist URI,Artist Popularity,Artist Genres,Track Duration(ms),Release Date,Track Popularity,Danceability,Energy,Key,Loudness,Mode,Speechiness,Acousticness,Instrumentalness,Liveness,Valence,Tempo,Type,Track ID,Uri,Track_href,Analysis_url,Duration_ms,Time_signature,Lyrics
Is It Over Now? (Taylor's Version) (From The Vault),Taylor Swift,spotify:artist:06HL4z0CvFAxyc27GXpf02,100,pop,229477,2023-10-26,93,0.596,0.658,0,-7.346,1,0.036,0.0504,0.0,0.127,0.176,100.012,audio_features,1Iq8oo9XkmmvCQiGOfORiz,spotify:track:1Iq8oo9XkmmvCQiGOfORiz,https://api.spotify.com/v1/tracks/1Iq8oo9XkmmvCQiGOfORiz,https://api.spotify.com/v1/audio-analysis/1Iq8oo9XkmmvCQiGOfORiz,229478,4,"Once the flight had flown (ah-ha)
With the wilt of the rose (ah-ha)
I slept all alone (ah-ha)
You still wouldn't go

Let's fast forward to 300 takeout coffees later
I see your profile and your smile on unsuspecting waiters
You dream of my mouth before it called you a lying traitor
You search in every maiden's bed for something greater
Baby, was it over when she laid down on your couch?
Was it over when he unbuttoned my blouse?
""Come here,"" I whispered in your ear in your dream as you passed out
Baby, was it over then
And is it over now?

When you lost control (ah-ha)
Red blood, white snow (ah-ha)
Blue dress on a boat (ah-ha)
"
Houdini,Dua Lipa,spotify:artist:6M2wZ9GZgrQXHCFfjv46we,86,"dance pop, pop, uk pop",185917,2023-11-09,93,0.744,0.789,9,-4.876,0,0.059,0.0036,0.00144,0.0947,0.866,116.985,audio_features,4OMJGnvZfDvsePyCwRGO7X,spotify:track:4OMJGnvZfDvsePyCwRGO7X,https://api.spotify.com/v1/tracks/4OMJGnvZfDvsePyCwRGO7X,https://api.spotify.com/v1/audio-analysis/4OMJGnvZfDvsePyCwRGO7X,185918,4,"Okay, huh, mm, ah

I come and I go
Tell me all the ways you need me
I'm not here for long
Catch me or I go Houdini
I come and I go
Prove you got the right to please me
Everybody knows
Catch me or I go Houdini

Time is passin' like a solar eclipse
See you watchin' and you blow me a kiss
It's your moment, baby, don't let it slip
Come in closer, are you readin' my lips?

They say I come and I go
Tell me all the ways you need me
I'm not here for long
Catch me or I go Houdini
I come and I go
"
bad idea right?,Olivia Rodrigo,spotify:artist:1McMsnEElThX1knmY4oliG,87,pop,184783,2023-08-11,57,0.628,0.878,9,-3.468,1,0.0901,0.00196,1.23e-05,0.0649,0.796,129.976,audio_features,2i8f4VnnBjy0yDqH2C452a,spotify:track:2i8f4VnnBjy0yDqH2C452a,https://api.spotify.com/v1/tracks/2i8f4VnnBjy0yDqH2C452a,https://api.spotify.com/v1/audio-analysis/2i8f4VnnBjy0yDqH2C452a,184784,4,"Hey

Haven't heard from you in a couple of months
But I'm out right now, and I'm all fucked up
And you're callin' my phone, you're all alone
And I'm sensin' some undertone

And I'm right here with all my friends
But you're sendin' me your new address
And I know we're done, I know we're through
But, God, when I look at you

My brain goes, ""Ah""
Can't hear my thoughts (I cannot hear my thoughts)
Like blah-blah-blah (blah, blah, blah, blah, blah, blah)
Should probably not
I should probably, probably not
I should probably, probably not

Seein' you tonight, it's a bad idea, right?
Seein' you tonight, it's a bad idea, right?
Seein' you tonight, it's a bad idea, right?
Seein' you tonight, fuck it, it's fine

Yes, I know that he's my ex, but can't two people reconnect?
"
"""Slut!"" (Taylor's Version) (From The Vault)",Taylor Swift,spotify:artist:06HL4z0CvFAxyc27GXpf02,100,pop,180381,2023-10-26,89,0.629,0.413,7,-13.178,1,0.055,0.345,7.62e-05,0.0603,0.306,77.983,audio_features,71BqAINEnezjQfxE4VuJfq,spotify:track:71BqAINEnezjQfxE4VuJfq,https://api.spotify.com/v1/tracks/71BqAINEnezjQfxE4VuJfq,https://api.spotify.com/v1/audio-analysis/71BqAINEnezjQfxE4VuJfq,180381,4,"Flamingo pink, Sunrise Boulevard
Clink, clink, being this young is art
Aquamarine, moonlit swimming pool
What if all I need is you?

Got love-struck, went straight to my head
Got lovesick all over my bed
Love to think you'll never forget
Handprints in wet cement

Adorned with smoke on my clothes
Lovelorn and nobody knows
Love thorns all over this rose
I'll pay the price, you won't

But if I'm all dressed up
They might as well be lookin' at us
And if they call me a slut
"
Boy's a liar Pt. 2,PinkPantheress,spotify:artist:78rUTD7y6Cy67W1RVzYs7t,76,bedroom pop,131013,2023-02-03,85,0.696,0.809,5,-8.254,1,0.05,0.252,0.000128,0.248,0.857,132.962,audio_features,6AQbmUe0Qwf5PZnt4HmTXv,spotify:track:6AQbmUe0Qwf5PZnt4HmTXv,https://api.spotify.com/v1/tracks/6AQbmUe0Qwf5PZnt4HmTXv,https://api.spotify.com/v1/audio-analysis/6AQbmUe0Qwf5PZnt4HmTXv,131013,4,"Take a look inside your heart, is there any room for me?
I won't have to hold my breath 'til you get down on one knee
Because you only want to hold me when I'm looking good enough
Did you ever feel me? Would you ever picture us?
Every time I pull my hair, well, it's only out of fear
That you'll find me ugly and one day you'll disappear because

What's the point of crying? It was never even love
Did you ever want me? Was I ever good enough?

The-the boy's a liar, the boy's a liar
He doesn't see ya, you're not looking at me, boy
The boy's a liar, the boy's a liar
He doesn't see ya, you're not looking at me, boy

"
Save Your Tears (with Ariana Grande) (Remix),The Weeknd,spotify:artist:1Xyo4u8uXC1ZmMpatF05PJ,93,"canadian contemporary r&b, canadian pop, pop",191013,2021-04-23,83,0.65,0.825,0,-4.645,1,0.0325,0.0215,2.44e-05,0.0936,0.593,118.091,audio_features,37BZB0z9T8Xu7U3e65qxFy,spotify:track:37BZB0z9T8Xu7U3e65qxFy,https://api.spotify.com/v1/tracks/37BZB0z9T8Xu7U3e65qxFy,https://api.spotify.com/v1/audio-analysis/37BZB0z9T8Xu7U3e65qxFy,191014,4,"Ooh (ooh)
Nah-nah, yeah

I saw you dancing in a crowded room (uh)
You look so happy when I'm not with you
But then you saw me, caught you by surprise
A single teardrop falling from your eye

I don't know why I run away (oh, oh, oh, oh, oh)
I'll make you cry when I run away (oh, oh, oh, oh, oh)

Take me back 'cause I wanna stay
Save your tears for another

"
august,Taylor Swift,spotify:artist:06HL4z0CvFAxyc27GXpf02,100,pop,261922,2020-07-24,90,0.532,0.623,5,-9.208,1,0.0331,0.538,7.28e-05,0.0925,0.403,89.937,audio_features,3hUxzQpSfdDqwM3ZTFQY0K,spotify:track:3hUxzQpSfdDqwM3ZTFQY0K,https://api.spotify.com/v1/tracks/3hUxzQpSfdDqwM3ZTFQY0K,https://api.spotify.com/v1/audio-analysis/3hUxzQpSfdDqwM3ZTFQY0K,261923,4,"Salt air, and the rust on your door
I never needed anything more
Whispers of ""Are you sure?""
""Never have I ever before""

But I can see us lost in the memory
August slipped away into a moment in time
'Cause it was never mine
And I can see us twisted in bedsheets
August sipped away like a bottle of wine
'Cause you were never mine

Your back beneath the sun
Wishin' I could write my name on it
Will you call when you're back at school?
I remember thinkin' I had you

But I can see us lost in the memory
August slipped away into a moment in time
'Cause it was never mine
"
greedy,Tate McRae,spotify:artist:45dkTj5sMRSjrmBSBeiHym,85,"alt z, pop",131872,2023-09-15,99,0.75,0.733,6,-3.18,0,0.0319,0.256,0.0,0.114,0.844,111.018,audio_features,3rUGC1vUpkDG9CZFHMur1t,spotify:track:3rUGC1vUpkDG9CZFHMur1t,https://api.spotify.com/v1/tracks/3rUGC1vUpkDG9CZFHMur1t,https://api.spotify.com/v1/audio-analysis/3rUGC1vUpkDG9CZFHMur1t,131872,1,"(Woo!)

He said, ""Are you serious? I've tried, but I can't figure out
I've been next to you all night and still don't know what you're about
You keep ta- (ta-ta-), talkin', but not much comin' out your mouth
Can't you tell that I want you?"" I say, yeah

I would want myself, baby, please believe me
I'll put you through hell just to know me, yeah-yeah
So sure of yourself, baby, don't get greedy
That shit won't end well (ooh-ooh), end well
(Uh-uh, uh-uh-uh, uh-uh) (woo)

"
positions,Ariana Grande,spotify:artist:66CXWjxzNUsdJxJ2JdwvnR,89,pop,172324,2020-10-23,1,0.736,0.802,0,-4.759,1,0.0864,0.468,0.0,0.094,0.675,144.005,audio_features,7igeByaBM0MgGsgXtNxDJ7,spotify:track:7igeByaBM0MgGsgXtNxDJ7,https://api.spotify.com/v1/tracks/7igeByaBM0MgGsgXtNxDJ7,https://api.spotify.com/v1/audio-analysis/7igeByaBM0MgGsgXtNxDJ7,172325,4,"Heaven sent you to me
I'm just hopin' I don't repeat history

Boy, I'm tryna meet your mama on a Sunday
Then make a lotta love on a Monday (ah-ah)
Never need no (no), no one else, babe
'Cause I'll be

Switchin' the positions for you
Cookin' in the kitchen, and I'm in the bedroom
I'm in the Olympics, way I'm jumpin' through hoops
Know my love infinite, nothin' I wouldn't do
That I won't do, switchin' for you

Perfect, perfect
You're too good to be true (you're too good to be true)
But I get tired of runnin'
Now I'm runnin' with you (wit' you)

"
Out of Time,The Weeknd,spotify:artist:1Xyo4u8uXC1ZmMpatF05PJ,93,"canadian contemporary r&b, canadian pop, pop",214193,2022-01-06,80,0.65,0.76,0,-4.422,0,0.0446,0.255,0.0,0.339,0.838,93.057,audio_features,2SLwbpExuoBDZBpjfefCtV,spotify:track:2SLwbpExuoBDZBpjfefCtV,https://api.spotify.com/v1/tracks/2SLwbpExuoBDZBpjfefCtV,https://api.spotify.com/v1/audio-analysis/2SLwbpExuoBDZBpjfefCtV,214194,4,"Yeah, yeah

The last few months, I've been working on me, baby
There's so much trauma in my life
I've been so cold to the ones who loved me, baby
I look back now and I realize

I remember when I held you
You begged me with your drowning eyes to stay
And I regret I didn't tell you
Now I can't keep you from loving him, you made up your mind

Say I love you, girl, but I'm out of time
Say I'm there for you, but I'm out of time
Say that I'll care for you, but I'm out of time
"
First Person Shooter (feat. J. Cole),Drake,spotify:artist:3TVXtAsR1Inumwj472S9r4,96,"canadian hip hop, canadian pop, hip hop, pop rap, rap",247444,2023-10-06,90,0.47,0.64,2,-7.779,1,0.32,0.0277,0.0,0.382,0.248,163.92,audio_features,7aqfrAY2p9BUSiupwk3svU,spotify:track:7aqfrAY2p9BUSiupwk3svU,https://api.spotify.com/v1/tracks/7aqfrAY2p9BUSiupwk3svU,https://api.spotify.com/v1/audio-analysis/7aqfrAY2p9BUSiupwk3svU,247444,4,"(Pew, pew-pew)

First-person shooter mode, we turnin' your song to a funeral
To them niggas that say they wan' off us, you better be talkin' 'bout workin' in cubicles
Yeah, them boys had it locked, but I knew the code
Lot of niggas debatin' my numeral
Not the three, not the two, I'm the U-N-O
Yeah
Numero U-N-O
Me and Drizzy, this shit like the Super Bowl
Man, this shit damn near big as the-

Big as the what? Big as the what? Big as the what?
Big as the Super Bowl
But the difference is it's just two guys playin' shit that they did in the studio
Niggas usually send they verses back to me, and they be terrible, just like a two-year-old
I love a dinner with some fine women when they start debatin' about who the G.O.A.T
I'm like go on 'head, say it then, who the G.O.A.T.?
Who the G.O.A.T.? Who the G.O.A.T.? Who the G.O.A.T.?

Who you bitches really rootin' for?
Like a kid that act bad from January to November, nigga, it's just you and Cole
Big as the what? Big as the what? Big as the what? (Ayy)
Big as the Super Bowl

Niggas so thirsty to put me in beef
Dissectin' my words and start lookin' too deep
I look at the tweets and start suckin' my teeth
I'm lettin' it rock 'cause I love the mystique
I still wanna get me a song with YB
Can't trust everything that you saw on IG
"
Die For You - Remix,The Weeknd,spotify:artist:1Xyo4u8uXC1ZmMpatF05PJ,93,"canadian contemporary r&b, canadian pop, pop",232857,2023-02-24,82,0.531,0.525,1,-6.5,0,0.0671,0.232,0.0,0.441,0.502,66.9,audio_features,7oDd86yk8itslrA9HRP2ki,spotify:track:7oDd86yk8itslrA9HRP2ki,https://api.spotify.com/v1/tracks/7oDd86yk8itslrA9HRP2ki,https://api.spotify.com/v1/audio-analysis/7oDd86yk8itslrA9HRP2ki,232857,4,"I'm findin' ways to articulate the feelin' I'm goin' through
I just can't say I don't love you (yeah)
'Cause I love you, yeah
It's hard for me to communicate the thoughts that I hold
But tonight, I'm gon' let you know
Let me tell the truth
Baby, let me tell the truth, yeah

You know what I'm thinkin', see it in your eyes
You hate that you want me, hate it when you cry
You're scared to be lonely, especially in the night
I'm scared that I'll miss you, happens every time

I don't want this feelin', I can't afford love
I try to find reason to pull us apart
It ain't workin', 'cause you're perfect
And I know that you're worth it, I can't walk away (hey)

Even though we'rе goin' through it (ah, ah)
And if it makes you feel alone
Just know that I would die for you (ooh, ooh)
Baby, I would die for you, yeah
"
34+35,Ariana Grande,spotify:artist:66CXWjxzNUsdJxJ2JdwvnR,89,pop,173710,2020-10-30,80,0.83,0.585,0,-6.476,1,0.094,0.237,0.0,0.248,0.485,109.978,audio_features,6Im9k8u9iIzKMrmV7BWtlF,spotify:track:6Im9k8u9iIzKMrmV7BWtlF,https://api.spotify.com/v1/tracks/6Im9k8u9iIzKMrmV7BWtlF,https://api.spotify.com/v1/audio-analysis/6Im9k8u9iIzKMrmV7BWtlF,173711,4,"Hmm

You might think I'm crazy
The way I've been cravin'
If I put it quite plainly
Just give me them babies
So, what you doing tonight?
Better say, ""doin' you right"" (yeah)
Watching movies, but we ain't seen a thing tonight (yeah)

I don't wanna keep you up (you up)
But show me, can you keep it up? (It up?)
'Cause then I'll have to keep you up
Shit, maybe I'ma keep you up, boy

I've been drinking coffee (I've been drinking coffee)
And I've been eating healthy (and I've been eating healthy)
You know I keep it squeaky, yeah (you know I keep it squeaky)
Saving up my energy (yeah, yeah, saving up my energy)

Can you stay up all night?
Fuck me 'til the daylight
34, 35 (yeah, yeah, yeah, yeah)
Can you stay up all night? (All night?)
Fuck me 'til the daylight
34, 35 (yeah, yeah, yeah, yeah)

Can we stay up all night? Fuck a jet lag
You bring yo' fine ass and overnight bag
"
Creepin' (with The Weeknd & 21 Savage),Metro Boomin,spotify:artist:0iEtIxbK0KxaSlF7G42ZOp,86,rap,221520,2022-12-02,92,0.715,0.62,1,-6.005,0,0.0484,0.417,0.0,0.0822,0.172,97.95,audio_features,2dHHgzDwk4BJdRwy9uXhTO,spotify:track:2dHHgzDwk4BJdRwy9uXhTO,https://api.spotify.com/v1/tracks/2dHHgzDwk4BJdRwy9uXhTO,https://api.spotify.com/v1/audio-analysis/2dHHgzDwk4BJdRwy9uXhTO,221520,4,"Man, we locked in right now HEROES & VILLIANS: Vilian Edition OG Ron C, DJ Chandlestick, moving at the chop starts We worldwide with this shit

Somebody said they say you
The person you are kissing wa-wasn't me
I- I would never ask you
I- I just kept it to myself
I- I don't wanna know
If you're playing me
Keep- keep it on the low
'Cause my heart can't take- take it anymore
And if you're creepin'
Pl- please don't let it show, oh, oh
Oh baby, I- I don't wanna know

Oh- oh yeah
Think a- about it when I hold you
Lo- lookin' in your eyes, I can't believe
I- I don't need to know the truth
Ba- baby. keep it to yourself

I- I don't wanna know
If you're playing me
Keep- keep it on the low
'Cau- 'cause my heart can't take- take it anymore
If- if you're creepin'
Please don't let it show
Oh- oh baby, I don't wanna know

Did he touch you better than me? (Touch you better than-)
I don't wanna know
Did he touch you better than me? (Touch you better than-)
I don't wanna know
"
vampire,Olivia Rodrigo,spotify:artist:1McMsnEElThX1knmY4oliG,87,pop,219724,2023-06-30,62,0.511,0.532,5,-5.745,1,0.056,0.169,0.0,0.311,0.322,137.827,audio_features,3k79jB4aGmMDUQzEwa46Rz,spotify:track:3k79jB4aGmMDUQzEwa46Rz,https://api.spotify.com/v1/tracks/3k79jB4aGmMDUQzEwa46Rz,https://api.spotify.com/v1/audio-analysis/3k79jB4aGmMDUQzEwa46Rz,219724,4,"I hate to give the satisfaction asking, ""How you're doing now?""
How's the castle built off people you pretend to care about?
Just what you wanted
Look at you, cool guy, you got it

I see the parties and the diamonds
Sometimes when I close my eyes
Six months of torture you sold as some forbidden paradise
I loved you truly
You gotta laugh at the stupidity

'Cause I've made some real big mistakes
But you make the worst one look fine
I should've known it was strange
You only come out at night

I used to think I was smart
But you made me look so naive
The way you sold me for parts
As you sunk your teeth into me, oh
Bloodsucker, dream crusher
"
The Box,Roddy Ricch,spotify:artist:757aE44tKEUQEqRuT6GnEB,75,"melodic rap, rap, trap",196652,2019-12-06,86,0.896,0.586,10,-6.687,0,0.0559,0.104,0.0,0.79,0.642,116.971,audio_features,0nbXyq5TXYPCO7pr3N8S4I,spotify:track:0nbXyq5TXYPCO7pr3N8S4I,https://api.spotify.com/v1/tracks/0nbXyq5TXYPCO7pr3N8S4I,https://api.spotify.com/v1/audio-analysis/0nbXyq5TXYPCO7pr3N8S4I,196653,4,"Pullin' out the coupe at the lot
Told 'em fuck 12, fuck SWAT
Bustin' all the bells out the box
I just hit a lick with the box
Had to put the stick in a box, mmh

Pour up the whole damn seal, I'ma get lazy
I got the mojo deals, we been trappin' like the '80s
She sucked a nigga soul, gotta Cash App
Told 'em wipe a nigga nose, say slatt, slatt
I won't never sell my soul, and I can back that
And I really wanna know, where you at, at?

I was out back, where the stash at?
Cruise the city in a bulletproof Cadillac (skrrt)
'Cause I know these niggas after where the bag at (yeah)
Gotta move smarter, gotta move harder
Niggas try to get me for my water
I'll lay his ass down on my son, or my daughter
I had the Draco with me, Dwayne Carter
Lotta niggas out here playin', ain't ballin'

I done out my whole arm in the rim, Vince Carter (yeah)
And I know probably get a key for the quarter
"
3D (feat. Jack Harlow),Jung Kook,spotify:artist:6HaGTQPmzraVmaVxvz6EUc,89,k-pop,201812,2023-09-29,89,0.853,0.824,1,-3.287,1,0.103,0.0322,0.0,0.0859,0.888,108.044,audio_features,6ehWdR7cGDXnT7aKEASJxE,spotify:track:6ehWdR7cGDXnT7aKEASJxE,https://api.spotify.com/v1/tracks/6ehWdR7cGDXnT7aKEASJxE,https://api.spotify.com/v1/audio-analysis/6ehWdR7cGDXnT7aKEASJxE,201812,4,"One, two, 3D

I can't touch you through the phone or kiss you through the universe
In another time zone, it's the only time I can't reverse
But when there's two dimensions, there's only one I'm missin'
And if you feel alone, you don't have to feel that no more

I just wanna see you like that
See you like that, uh-uh

So if you're ready (so if you're ready)
And if you'll let me (and if you'll let me)
I wanna see it in motion, in 3D (uh-uh)
You won't regret me (you won't regret me)
Champagne confetti (champagne confetti)
I wanna see it in motion, in 3D

'Cause you know how I like it, girl (girl)
3D (woo)
You know how I like it, girl (girl)
3D (woo)

Body to body to body to body to body
You and me baby, you know that we got it
So don't go gettin' me started
'Cause you know I get hot-hearted
Baby, oh, baby, oh, baby, you makin' me crazy
Rain, rain, rain, you can't fake it
You give me brand-new emotion
You got me drinkin' that potion

"
CUFF IT,Beyoncé,spotify:artist:6vWDO969PvNqNYHIOW5v0m,84,"pop, r&b",225388,2022-07-29,84,0.78,0.689,7,-5.668,1,0.141,0.0368,9.69e-06,0.0698,0.642,115.042,audio_features,1xzi1Jcr7mEi9K2RfzLOqS,spotify:track:1xzi1Jcr7mEi9K2RfzLOqS,https://api.spotify.com/v1/tracks/1xzi1Jcr7mEi9K2RfzLOqS,https://api.spotify.com/v1/audio-analysis/1xzi1Jcr7mEi9K2RfzLOqS,225389,4,"I feel like falling in love (falling in love)
I'm in the mood to roll something up (tonight I'm rolling something up, baby)
I need some drink in my cup (I need a drink), hey (pour me a drink)
I'm in the mood to pour something up (I'm in the mood to pour something up)

I wanna go missing, I need a prescription
I wanna go higher, can I sit on top of you? (Oh-la-la-la-la)
I wanna go where nobody's been (I wanna go where nobody's been)
Have you ever had fun like this? (Have you ever had fun like this?) oh, woah

We gon' roll up tonight, black lights
Spaceships fly (spaceships fly), yeah
Unapologetic when we pull up tonight (roll it up, roll it up), pull up tonight
We gettin' poured up tonight
We gon' pull up tonight

Bet you you'll see far
Bet you you'll see stars
Bet you you'll elevate
Bet you you'll need God
'Cause I feel like falling in love
I'm in the mood to pour something up
'Cause we gon' roll up tonight

What's in these four walls? You sexy, my love (turn it up)
Don't miss this roll call, is you here or what? (Roll it up), yeah
Show up, show up (show up, show up), pour up, pour up (pour up, pour up), oh
"
Laugh Now Cry Later (feat. Lil Durk),Drake,spotify:artist:3TVXtAsR1Inumwj472S9r4,96,"canadian hip hop, canadian pop, hip hop, pop rap, rap",261492,2020-08-14,80,0.761,0.518,0,-8.871,1,0.134,0.244,3.47e-05,0.107,0.522,133.976,audio_features,2SAqBLGA283SUiwJ3xOUVI,spotify:track:2SAqBLGA283SUiwJ3xOUVI,https://api.spotify.com/v1/tracks/2SAqBLGA283SUiwJ3xOUVI,https://api.spotify.com/v1/audio-analysis/2SAqBLGA283SUiwJ3xOUVI,261493,4,"Woah, woah
Yeah

Sometimes we laugh and sometimes we cry, but I guess you know now, baby
I took a half and she took the whole thing, slow down, baby (baby)
We took a trip, now we on your block and it's like a ghost town, baby
Where do these niggas be at when they say they doin' all this and all that?

Tired of beefin' you bums, you can't even pay me enough to react
Been wakin' up in the crib and sometimes I don't even know where I'm at
Please don't play that nigga songs in this party, I can't even listen to that
Anytime that I ran into somebody, it must be a victory lap, ayy
Shawty, come sit on my lap, ayy, they sayin' Drizzy just snap
Distance between us is not like a store, this isn't a closeable gap, ayy
I've seen some niggas attack and don't end up makin' it back

I know that they at the crib goin' crazy, down bad
What they had didn't last, damn, baby

Sometimes we laugh and sometimes we cry, but I guess you know now, baby
I took a half and she took the whole thing, slow down, baby (baby)
We took a trip, now we on your block and it's like a ghost town, baby
"
"What Was I Made For? [From The Motion Picture ""Barbie""]",Billie Eilish,spotify:artist:6qqNVTkY8uBg9cP3Jd7DAH,87,"art pop, pop",222369,2023-07-13,93,0.444,0.0911,0,-17.665,1,0.0307,0.959,1.05e-06,0.098,0.142,78.403,audio_features,6wf7Yu7cxBSPrRlWeSeK0Q,spotify:track:6wf7Yu7cxBSPrRlWeSeK0Q,https://api.spotify.com/v1/tracks/6wf7Yu7cxBSPrRlWeSeK0Q,https://api.spotify.com/v1/audio-analysis/6wf7Yu7cxBSPrRlWeSeK0Q,222370,4,"Hm, hm

I used to float, now I just fall down
I used to know, but I'm not sure now
What I was made for

What was I made for?

Taking a drive, I was an ideal
Looked so alive, turns out I'm not real
Just something you paid for
What was I made for? Hm

'Cause I, I
"
Blinding Lights,The Weeknd,spotify:artist:1Xyo4u8uXC1ZmMpatF05PJ,93,"canadian contemporary r&b, canadian pop, pop",201573,2019-11-29,19,0.513,0.796,1,-4.075,1,0.0629,0.00147,0.000209,0.0938,0.345,171.017,audio_features,0sf12qNH5qcw8qpgymFOqD,spotify:track:0sf12qNH5qcw8qpgymFOqD,https://api.spotify.com/v1/tracks/0sf12qNH5qcw8qpgymFOqD,https://api.spotify.com/v1/audio-analysis/0sf12qNH5qcw8qpgymFOqD,201573,4,"Yeah

I've been tryna call
I've been on my own for long enough
Maybe you can show me how to love, maybe
I'm going through withdrawals
You don't even have to do too much
You can turn me on with just a touch, baby

I look around and
Sin City's cold and empty (oh)
No one's around to judge me (oh)
I can't see clearly when you're gone

I said, ooh, I'm blinded by the lights
"
MELTDOWN (feat. Drake),Travis Scott,spotify:artist:0Y5tJX1MQlPlqiwlOH1tJY,91,"hip hop, rap, slap house",246133,2023-07-28,87,0.557,0.774,7,-5.275,0,0.351,0.012,0.0,0.396,0.397,111.975,audio_features,67nepsnrcZkowTxMWigSbb,spotify:track:67nepsnrcZkowTxMWigSbb,https://api.spotify.com/v1/tracks/67nepsnrcZkowTxMWigSbb,https://api.spotify.com/v1/audio-analysis/67nepsnrcZkowTxMWigSbb,246134,4,"Yeah
Tensions is definitely rising
T'd up right now
T time, T time
T time, T time, T time

Tea time like I got a cup of this sh-
Tee time like golf at a quarter to six
I'd love to f- on a regular bitch
Famous h- lame but they stay on my d-
Heard your new joint, it's embarrassing, sh-
You talk to the cops on some therapist sh-
You act like you love this American sh-
But, really, the truth is you scared of the 6
Yeah, you scared of the 6
Yeah, you scared of the 6

Your bodyguard put in some work on a fluke
Now you wanna go and inherit that sh-
Don't talk to the boy 'bout comparisons, sh-
Or come to the boy on some arrogant sh-
The weapons we got are some terrorist sh-
Like TV producers we, grr, we airing this sh-
She askin' for bread for her parents and sh-
I told her, ""I don't got no cash"", and she said she gon' wait on a rack, on some Arabic sh-

I pull out a million and stare at the sh-
My d- just got hard 'cause a wire just hit
My schedule is out, come spin us, for real
Man, f- all that spinnin' the narrative sh-

I melt down the chains that I bought from yo' boss
Give a f- about all of that heritage sh-
"
